{
  "scannedAt": "2026-10-21T15:34:27Z",
  "scannerVersion": "1.0.0",
  "goVersion": "go1.27.3",
  "results": [
    {
      "host": "licindia.in",
      "org": "Life Insurance Corporation of India",
      "sector": "insurance",
      "subsector": "life_insurer",
      "verified": false,
      "shelfLifeYears": 15,
      "reachable": true,
      "tls": {
        "maxVersion": "TLS1.3",
        "defaultGroup": "X25519MLKEM768",
        "pqHybrid": {
          "x25519mlkem768": true,
          "secp256r1mlkem768": false,
          "secp384r1mlkem1024": false
        },
        "legacyEnabled": false,
        "cipherSuite": "TLS_AES_256_GCM_SHA384",
        "alpn": "h2"
      },
      "cert": {
        "keyAlgorithm": "RSA",
        "keySize": 2048,
        "signatureAlgorithm": "SHA384-RSA",
        "issuer": "CN=EM OV TLS CA - G2A-1,O=eMudhra Technologies Limited,C=IN",
        "notAfter": "2026-12-28T11:16:07Z",
        "chainSignatureAlgorithms": [
          "SHA384-RSA",
          "SHA256-RSA",
          "SHA256-RSA"
        ],
        "valid": true
      },
      "http": {
        "hsts": true,
        "server": "v/7.0.6/6.6.9/v103ccu1-www",
        "cdn": "other"
      },
      "probes": {
        "default": {
          "ok": true,
          "detail": "TLS1.3 X25519MLKEM768"
        },
        "pqOnly": {
          "ok": true
        },
        "pqAlt": {
          "ok": false,
          "detail": "TLS_FAIL"
        },
        "tls13": {
          "ok": true
        },
        "legacy": {
          "ok": false,
          "detail": "TLS_FAIL"
        },
        "head": {
          "ok": true
        }
      },
      "grade": "A+",
      "hygieneFlags": [],
      "hndlRisk": 0
    },
    {
      "host": "paytm.com",
      "org": "Paytm",
      "sector": "payments",
      "subsector": "upi_app",
      "verified": false,
      "shelfLifeYears": 7,
      "reachable": true,
      "tls": {
        "maxVersion": "TLS1.3",
        "defaultGroup": "X25519MLKEM768",
        "pqHybrid": {
          "x25519mlkem768": true,
          "secp256r1mlkem768": false,
          "secp384r1mlkem1024": false
        },
        "legacyEnabled": false,
        "cipherSuite": "TLS_AES_128_GCM_SHA256",
        "alpn": "h2"
      },
      "cert": {
        "keyAlgorithm": "ECDSA",
        "keySize": 256,
        "curve": "P-256",
        "signatureAlgorithm": "ECDSA-SHA256",
        "issuer": "CN=GeoTrust TLS ECC CA G1,OU=www.digicert.com,O=DigiCert Inc,C=US",
        "notAfter": "2027-03-10T23:59:59Z",
        "chainSignatureAlgorithms": [
          "ECDSA-SHA256"
        ],
        "valid": true
      },
      "http": {
        "hsts": true,
        "server": "cloudflare",
        "cdn": "cloudflare"
      },
      "probes": {
        "default": {
          "ok": true,
          "detail": "TLS1.3 X25519MLKEM768"
        },
        "pqOnly": {
          "ok": true
        },
        "pqAlt": {
          "ok": false,
          "detail": "TLS_FAIL"
        },
        "tls13": {
          "ok": true
        },
        "legacy": {
          "ok": false,
          "detail": "TLS_FAIL"
        },
        "head": {
          "ok": true
        }
      },
      "grade": "A+",
      "hygieneFlags": [],
      "hndlRisk": 0
    },
    {
      "host": "uidai.gov.in",
      "org": "Unique Identification Authority of India",
      "sector": "government",
      "subsector": "identity",
      "verified": false,
      "shelfLifeYears": 25,
      "reachable": true,
      "tls": {
        "maxVersion": "TLS1.3",
        "defaultGroup": "X25519",
        "pqHybrid": {
          "x25519mlkem768": false,
          "secp256r1mlkem768": false,
          "secp384r1mlkem1024": false
        },
        "legacyEnabled": false,
        "cipherSuite": "TLS_AES_256_GCM_SHA384",
        "alpn": "http/1.1"
      },
      "cert": {
        "keyAlgorithm": "RSA",
        "keySize": 2048,
        "signatureAlgorithm": "SHA384-RSA",
        "issuer": "CN=EM OV TLS CA - G2A-1,O=eMudhra Technologies Limited,C=IN",
        "notAfter": "2027-01-13T01:14:06Z",
        "chainSignatureAlgorithms": [
          "SHA384-RSA",
          "SHA256-RSA",
          "SHA256-RSA"
        ],
        "valid": true
      },
      "http": {
        "hsts": false,
        "cdn": null
      },
      "probes": {
        "default": {
          "ok": true,
          "detail": "TLS1.3 X25519"
        },
        "pqOnly": {
          "ok": false,
          "detail": "TLS_FAIL"
        },
        "pqAlt": {
          "ok": false,
          "detail": "TLS_FAIL"
        },
        "tls13": {
          "ok": true
        },
        "legacy": {
          "ok": false,
          "detail": "TLS_FAIL"
        },
        "head": {
          "ok": true
        }
      },
      "grade": "C",
      "hygieneFlags": [
        "NO_HSTS"
      ],
      "hndlRisk": 100
    },
    {
      "host": "www.aiims.edu",
      "org": "AIIMS New Delhi",
      "sector": "healthcare",
      "subsector": "hospital",
      "verified": false,
      "shelfLifeYears": 25,
      "reachable": true,
      "tls": {
        "maxVersion": "TLS1.2",
        "defaultGroup": "P-256",
        "pqHybrid": {
          "x25519mlkem768": false,
          "secp256r1mlkem768": false,
          "secp384r1mlkem1024": false
        },
        "legacyEnabled": true,
        "cipherSuite": "TLS_ECDHE_RSA_WITH_AES_256_GCM_SHA384"
      },
      "cert": {
        "keyAlgorithm": "RSA",
        "keySize": 2048,
        "signatureAlgorithm": "SHA256-RSA",
        "issuer": "CN=YR1,O=Let's Encrypt,C=US",
        "notAfter": "2027-01-05T10:55:54Z",
        "chainSignatureAlgorithms": [
          "SHA256-RSA",
          "SHA256-RSA"
        ],
        "valid": true
      },
      "http": {
        "hsts": false,
        "server": "nginx",
        "cdn": null
      },
      "probes": {
        "default": {
          "ok": true,
          "detail": "TLS1.2 P-256"
        },
        "pqOnly": {
          "ok": false,
          "detail": "TLS_FAIL"
        },
        "pqAlt": {
          "ok": false,
          "detail": "TLS_FAIL"
        },
        "tls13": {
          "ok": false,
          "detail": "TLS_FAIL"
        },
        "legacy": {
          "ok": true,
          "detail": "TLS1.1"
        },
        "head": {
          "ok": true
        }
      },
      "grade": "D",
      "hygieneFlags": [
        "LEGACY_TLS",
        "NO_HSTS"
      ],
      "hndlRisk": 100
    },
    {
      "host": "www.airtel.in",
      "org": "Bharti Airtel",
      "sector": "telecom",
      "subsector": "mobile_operator",
      "verified": false,
      "shelfLifeYears": 5,
      "reachable": true,
      "tls": {
        "maxVersion": "TLS1.3",
        "defaultGroup": "X25519MLKEM768",
        "pqHybrid": {
          "x25519mlkem768": true,
          "secp256r1mlkem768": false,
          "secp384r1mlkem1024": false
        },
        "legacyEnabled": false,
        "cipherSuite": "TLS_AES_256_GCM_SHA384",
        "alpn": "h2"
      },
      "cert": {
        "keyAlgorithm": "RSA",
        "keySize": 2048,
        "signatureAlgorithm": "SHA256-RSA",
        "issuer": "CN=YR2,O=Let's Encrypt,C=US",
        "notAfter": "2026-12-22T04:31:56Z",
        "chainSignatureAlgorithms": [
          "SHA256-RSA",
          "SHA256-RSA"
        ],
        "valid": true
      },
      "http": {
        "hsts": true,
        "server": "Apache",
        "cdn": null
      },
      "probes": {
        "default": {
          "ok": true,
          "detail": "TLS1.3 X25519MLKEM768"
        },
        "pqOnly": {
          "ok": true
        },
        "pqAlt": {
          "ok": false,
          "detail": "TLS_FAIL"
        },
        "tls13": {
          "ok": true
        },
        "legacy": {
          "ok": false,
          "detail": "TLS_FAIL"
        },
        "head": {
          "ok": true
        }
      },
      "grade": "A+",
      "hygieneFlags": [],
      "hndlRisk": 0
    },
    {
      "host": "www.axisbank.com",
      "org": "Axis Bank",
      "sector": "banking",
      "subsector": "private_bank",
      "verified": false,
      "shelfLifeYears": 10,
      "reachable": true,
      "tls": {
        "maxVersion": "TLS1.3",
        "defaultGroup": "X25519MLKEM768",
        "pqHybrid": {
          "x25519mlkem768": true,
          "secp256r1mlkem768": false,
          "secp384r1mlkem1024": false
        },
        "legacyEnabled": false,
        "cipherSuite": "TLS_AES_256_GCM_SHA384",
        "alpn": "h2"
      },
      "cert": {
        "keyAlgorithm": "RSA",
        "keySize": 2048,
        "signatureAlgorithm": "SHA256-RSA",
        "issuer": "CN=GeoTrust TLS RSA CA G1,OU=www.digicert.com,O=DigiCert Inc,C=US",
        "notAfter": "2027-01-15T23:59:59Z",
        "chainSignatureAlgorithms": [
          "SHA256-RSA"
        ],
        "valid": true
      },
      "http": {
        "hsts": false,
        "server": "AkamaiGHost",
        "cdn": "akamai"
      },
      "probes": {
        "default": {
          "ok": true,
          "detail": "TLS1.3 X25519MLKEM768"
        },
        "pqOnly": {
          "ok": true
        },
        "pqAlt": {
          "ok": false,
          "detail": "TLS_FAIL"
        },
        "tls13": {
          "ok": true
        },
        "legacy": {
          "ok": false,
          "detail": "TLS_FAIL"
        },
        "head": {
          "ok": true
        }
      },
      "grade": "A+",
      "hygieneFlags": [
        "NO_HSTS"
      ],
      "hndlRisk": 0
    },
    {
      "host": "www.digilocker.gov.in",
      "org": "DigiLocker",
      "sector": "government",
      "subsector": "identity",
      "verified": false,
      "shelfLifeYears": 25,
      "reachable": true,
      "tls": {
        "maxVersion": "TLS1.3",
        "defaultGroup": "X25519MLKEM768",
        "pqHybrid": {
          "x25519mlkem768": true,
          "secp256r1mlkem768": true
        },
        "legacyEnabled": false,
        "cipherSuite": "TLS_AES_128_GCM_SHA256",